### ISSUE TITLE
Oversized request frames in m1-da-light-node protocol

### ISSUE THREAD

**Issue by mzabaluev** [movementlabsxyz/movement#689]
In certain conditions, the transaction pipeline in the Suzuka full node forms `BatchWrite` requests with a frame size that exceeds the limit used by the gRPC server on m1-da-light-node. The server responds with a GoAway frame carrying the reason `FRAME_SIZE_ERROR`. We have come up with two proposed ways to deal with the problem:

1. Short-term: Explicitly set the [`max_frame_size`](https://docs.rs/tonic/latest/tonic/transport/struct.Server.html#method.max_frame_size) server parameter to a limit defined in our code base, and make sure the `BatchWrite` requests sent by the node (and other potentially large requests or responses) do not exceed that limit.

2. Define another RPC method to replace `BatchWrite`, with client streaming to push blobs to DA incrementally.  The blob upload stream can even be kept as a long-running request to upload transactions continuously rather than in batches. This will also provide back-pressure on the suzuka node.

**Comment by l-monninger** [comment]
So, I've tried playing around with first this and all of the settings that get passed down to `h2`, no luck yet.

**Comment by l-monninger** [comment]
I also don't see how the client would be constructing frames that are too large from the `BatchWrite` being sent over. Raw encoded it's ~4000 bytes.

<img width="850" alt="Screenshot 2024-10-11 at 1 11 22 PM" src="https://github.com/user-attachments/assets/063c0b82-f548-4585-919f-bbb03a181d51">

**Comment by l-monninger** [comment]
Amongst other things I tried to see if this was because of `allow_http1` on the `tonic` server. But, that also didn't work. Otherwise, I've just played with a bunch of `h2` things that aren't the frame size.

**Comment by l-monninger** [comment]
I'm wondering if it has to do with something like this: https://github.com/golang/go/issues/32112#issuecomment-494167668

**Comment by l-monninger** [comment]
I feel like it's most likely an http/1 http/2 upgrade thing, but I don't see why this would just start happening out of the blue occasionally.

**Comment by mzabaluev** [comment]
Try capturing the TCP packets between suzuka-full-node and m1-da-light-node.

**Comment by l-monninger** [comment]
@mzabaluev 

I've tried `tcpdump` and tracing `hyper` and `h2` crates. I don't think I've found anything clear yet. Do you want to compare pcaps?

```
sudo tcpdump -i lo0 'tcp port 30730' -s 0 -vvv -w m1-da-light-node.pcap
```

[m1-da-light-node.pcap.zip](https://github.com/user-attachments/files/17351448/m1-da-light-node.pcap.zip)

- No where in this dump is it indicated that the [`LightNodeService`](https://github.com/movementlabsxyz/movement/blob/main/proto/movementlabs/protocol_units/da/m1/light_node/v1beta1.proto) is being called. Instead it seems to be attempting to server reflect and failing then. 
- I'm trying to understand why packet 15 (and others similar) are being sent. I think this is the starting point of the failure, but IDK why the client is trying to use reflection. 
- The client in my case has the small frame size (actually minimum frame size). It's difficult to set with the way `tonic` has exposed the `h2` in the `Channel` abstraction. As far as I understand, it is possible that the client would send a GOAWAY to the server and perhaps raise this error when that is reflected back, i.e., the opposite of the circumstance we originally though. I'm still not seeing how the data in the frames captured here exceeds the `MAX_FRAME_SIZE`. Also, the client does not appear to terminate the connection, as it keeps pining.

**Comment by mzabaluev** [comment]
The window size increment requested by the server looks rather huge:

Frame 11: 78 bytes on wire (624 bits), 78 bytes captured (624 bits)
Null/Loopback
Internet Protocol Version 4, Src: 127.0.0.1, Dst: 127.0.0.1
Transmission Control Protocol, Src Port: 30730, Dst Port: 50582, Seq: 28, Ack: 34, Len: 22
HyperText Transfer Protocol 2
    Stream: SETTINGS, Stream ID: 0, Length 0
        Length: 0
        Type: SETTINGS (4)
        Flags: 0x01, ACK
        0... .... .... .... .... .... .... .... = Reserved: 0x0
        .000 0000 0000 0000 0000 0000 0000 0000 = Stream Identifier: 0
HyperText Transfer Protocol 2
    Stream: WINDOW_UPDATE, Stream ID: 0, Length 4
        Length: 4
        Type: WINDOW_UPDATE (8)
        Flags: 0x00
        0... .... .... .... .... .... .... .... = Reserved: 0x0
        .000 0000 0000 0000 0000 0000 0000 0000 = Stream Identifier: 0
        0... .... .... .... .... .... .... .... = Reserved: 0x0
        .000 0000 0000 1111 0000 0000 0000 0001 = Window Size Increment: 983041
        [Connection window size (before): 65535]
        [Connection window size (after): 1048576]

**Comment by l-monninger** [comment]
@mzabaluev Yeah, I set the window to its max on the server.

**Comment by mzabaluev** [comment]
> [m1-da-light-node.pcap.zip](https://github.com/user-attachments/files/17351448/m1-da-light-node.pcap.zip)

It looks like the client possibly "does not like" something in the `/grpc.reflection.v1.ServerReflection/ServerReflectionInfo` response (frame 55), however like you, I'm at a loss to explain why does it hit the reflection RPC at all.

**Comment by mzabaluev** [comment]
It looks like the server-side rejection that was observed occurs on the ALB proxy.
But we still need to be conscious about the protocol limits.

**Comment by l-monninger** [comment]
Closing this and linked issues as this is ALB-related.
